file,id,pageURL,user,user_id,tags,sourceQuery,phash
images/land_001.jpg,3799279,https://pixabay.com/photos/land-outdoors-meadow-field-hill-3799279/,jplenio,7645255,"land, outdoors, meadow, field, hill, landscape, nature, rural, grass",rolling hills,
images/land_002.jpg,3585202,https://pixabay.com/photos/fields-grass-hill-nature-landscape-3585202/,Schwoaze,4023294,"fields, grass, hill, nature, landscape, sky, clouds, scenic, idyllic, sunny, hill, mountain",rolling hills,
images/land_003.jpg,10310591,https://pixabay.com/photos/mountains-mist-forest-autumn-10310591/,aszak,22997580,"mountains, mist, forest, autumn, ridges, landscape, sunlight, valley, nature, golden, tranquility, panorama, ecology, natural beauty, travel, silence, terrain, morning, climate",rolling hills,
images/land_004.jpg,1707192,https://pixabay.com/photos/tuscany-landscape-cypress-1707192/,kasabubu,1559919,"tuscany, landscape, cypress, wilderness, outdoors, nature",rolling hills,
images/land_005.jpg,2165759,https://pixabay.com/photos/hills-blue-sky-clouds-farmlands-2165759/,ClickerHappy,324082,"hills, blue sky, clouds, farmlands, fields, meadows, sky, nature, landscape, field, summer, rural, italy, agricultural, tuscany, countryside, hills, fields, sky, field, italy, tuscany, countryside",rolling hills,
images/land_006.jpg,7452555,https://pixabay.com/photos/feather-dune-desert-sand-7452555/,fotoblend,87167,"feather, dune, desert, sand, dune landscape, barren, landscape, nature, north, hd background, feather, feather, feather, feather, feather, desert, desert, desert, desert",desert dunes,
images/land_007.jpg,7150369,https://pixabay.com/photos/sand-desert-sahara-dune-nature-7150369/,Noel_Bauza,2019050,"sand, desert, sahara, dune, nature, africa, tunisia, sand, sand, desert, desert, desert, desert, desert, tunisia",desert dunes,
images/land_008.jpg,4965457,https://pixabay.com/photos/namibia-desert-sand-dune-dunes-4965457/,KevinSchmid,15711311,"namibia, desert, sand, dune, dunes, sossusvlei, sahara, dry, nature, tree, sand dunes, namib desert, sandy, hot, chameleon, automobile, scrap metal, stone desert, heaven, landscape, dryness, desert, desert, desert, desert, desert",desert dunes,
images/water_001.jpg,4605202,https://pixabay.com/photos/bridge-morning-calm-lake-sunrise-4605202/,zhangliams,606349,"bridge, morning, nature, calm, lake, sunrise, calm morning, the morning sun, river, light, view",calm lake,
images/water_002.jpg,5933622,https://pixabay.com/photos/lake-mountains-trees-alps-alpine-5933622/,Nature_Brothers,19732775,"lake, mountains, trees, alps, alpine, snow mountains, conifers, coniferous, conifer forest, mountain lake, calm waters, mirroring, mirror image, reflection, water reflection, forest, sky, landscape, nature, water, switzerland, bergsee, scenic, summit, panorama, lake, lake, mountain lake, switzerland, switzerland, switzerland, switzerland, switzerland",calm lake,
images/water_003.jpg,10290205,https://pixabay.com/photos/lake-boat-reflection-nature-calm-10290205/,fietzfotos,6795508,"lake, boat, reflection, nature, calm, reeds, tree, spring, sky, landscape, peace, green, stillness, shore, bushes, clouds, relaxation, greenery, trail, action",calm lake,
images/water_004.jpg,1014712,https://pixabay.com/photos/sunrise-boat-rowing-boat-nobody-1014712/,quangle,1584596,"sunrise, boat, rowing boat, nobody, calm, tranquil, blue, sea, lake, water, phu quoc, ocean, sky, travel, tropical, summer, vietnam, color, holiday, vacation, nature, reflection, evening, blue sky, sunset, beautiful, landscape, dawn, morning",calm lake,
images/water_005.jpg,7736415,https://pixabay.com/photos/swans-birds-lake-water-birds-pond-7736415/,icecube11,3267392,"swans, nature, birds, lake, water birds, pond, wildlife, animals",calm lake,
images/water_006.jpg,5889982,https://pixabay.com/photos/torii-lake-twilight-dawn-sunrise-5889982/,Kanenori,4749850,"torii, lake, twilight, dawn, sunrise, before the dawn, nature, scenic, japanese gate, shirahige shrine, shinto shrine, lake biwa, shiga prefecture, japan",calm lake,
images/water_007.jpg,8424565,https://pixabay.com/photos/sunset-lake-water-reflection-8424565/,MaabHasanLENS,5595412,"sunset, lake, nature, water, reflection",calm lake,
images/water_008.jpg,1802337,https://pixabay.com/photos/lake-sunset-rocks-bank-conifers-1802337/,strikers,3532212,"lake, sunset, rocks, bank, conifers, dusk, twilight, sky, clouds, water reflection, reflection, landscape, water, scenic, nature, ripples, sunrise, sunlight, zoom background, lake, lake, sunset, sky, landscape, water, water, nature, nature, nature, nature, nature, sunrise, sunrise",calm lake,
images/water_009.jpg,407252,https://pixabay.com/photos/pier-fog-lake-dock-wooden-pier-407252/,SplitShire,364019,"pier, fog, lake, dock, wooden pier, jetty, sea, ocean, foggy, mist, peaceful, idyllic, scenic, nature, fog, lake, sea, sea, ocean, peaceful, nature, nature, nature, nature, nature",calm lake,
images/water_010.jpg,10301575,https://pixabay.com/photos/house-on-water-bay-architecture-10301575/,Kreidt-Fotografie,14547039,"house on water, bay, architecture, lake, nature, tranquility, wooden building, summer atmosphere, idyll, water, trees, branch, wood, window, roofs, peaceful environment, solitude, reflection, calm water, end of winter",calm lake,
images/water_011.jpg,5499649,https://pixabay.com/photos/sea-wave-splash-big-wave-ocean-5499649/,Kanenori,4749850,"sea, wave, splash, big wave, ocean, nature, water, indian ocean, seascape",ocean waves,
images/structure_001.jpg,7900146,https://pixabay.com/photos/bridge-fog-california-metal-steel-7900146/,alexleonleon,29624212,"bridge, fog, california, metal, steel, san francisco, architecture, city",steel bridge,
images/structure_002.jpg,1837166,https://pixabay.com/photos/arches-architecture-bridge-columns-1837166/,Pexels,2286921,"arches, architecture, bridge, columns, construction, curve, nature, engineering, foundation, outdoors, steel, travel, water",steel bridge,
images/structure_003.jpg,9568428,https://pixabay.com/photos/building-city-train-weather-sky-9568428/,Chrehan6_6,49746523,"building, city, train, weather, sky, nature, sunset, night, stars, landscape, clouds, night sky, sun, moon, sea, seagulls, farm, forest, flying, migration, tree, outdoors, dusk, hiking, birds, horizon",steel bridge,
images/structure_004.jpg,1140758,https://pixabay.com/photos/bridge-suspension-bridge-1140758/,652234,652234,"bridge, suspension bridge, architecture, bridge construction, steel construction, steel bridge, bridge arch, detail shot, neuss, bridge, bridge, bridge, bridge, bridge, suspension bridge, architecture, bridge construction",steel bridge,
images/structure_005.jpg,8198882,https://pixabay.com/photos/bridge-viaduct-architecture-8198882/,lecreusois,25340,"bridge, viaduct, architecture, historical, steel, beams, rivet, rails, bridge, bridge, bridge, bridge, bridge",steel bridge,
images/structure_006.jpg,8411524,https://pixabay.com/photos/railway-winter-train-tracks-snow-8411524/,gosiak1980,2374509,"railway, nature, winter, train tracks, snow, city",steel bridge,
images/structure_007.jpg,8517089,https://pixabay.com/photos/train-station-subway-metro-8517089/,Wolfgang-1958,32693390,"train, station, subway, metro, architecture, cityscape, transport, modern, futuristic, building, steel construction, germany, hamburg, track, railroad, rails, railroad track, elbe bridge, hafencity",steel bridge,
images/structure_008.jpg,5738714,https://pixabay.com/photos/building-bank-facade-reflection-5738714/,Portraitor,13619724,"building, bank, facade, reflection, modern, urban, city, nature, water, office building, architecture, stuttgart, germany",steel bridge,
images/structure_009.jpg,2289426,https://pixabay.com/photos/bridge-architecture-infrastructure-2289426/,Engin_Akyurt,3656355,"bridge, architecture, infrastructure, contemporary, geometric shapes, design, outdoors, building, metal structure, structure, asia, malaysia, bridge, bridge, bridge, architecture, architecture, architecture, architecture, architecture, infrastructure, infrastructure, infrastructure, design, building, malaysia",steel bridge,
images/structure_010.jpg,7377716,https://pixabay.com/photos/bridge-tunnel-alley-architecture-7377716/,Bilderwelt68,27027720,"bridge, tunnel, alley, architecture, murinsel, styria, graz, sights, city, austria, bridge, tunnel, alley, graz, graz, city, city, city, city, city",steel bridge,
images/structure_011.jpg,5676506,https://pixabay.com/photos/building-architecture-facade-5676506/,rotekirsche20,18445331,"building, architecture, facade, skyscraper, exterior, windows, office building, residential building, urban, city",skyscraper exterior,
images/structure_012.jpg,7001027,https://pixabay.com/photos/city-skyscraper-buildings-facade-7001027/,rperucho,7689351,"city, skyscraper, buildings, facade, architecture, exterior, urban, contemporary architecture, modern architecture",skyscraper exterior,
images/structure_013.jpg,6781885,https://pixabay.com/photos/building-architecture-facade-6781885/,taylormatt2014cbu,24260263,"building, architecture, facade, exterior, urban, city, downtown, building, building, building, building, architecture, architecture, architecture, architecture, architecture, city",skyscraper exterior,
images/motion_001.jpg,2531194,https://pixabay.com/photos/waterfall-black-and-white-water-2531194/,Felix-Mittermeier,4397258,"waterfall, black-and-white, water, waters, hydropower, watercourse, mystical, long exposure, attraction, nature, sightseeing, atmospheric, schleissheim",waterfall long exposure,
images/motion_002.jpg,7962263,https://pixabay.com/photos/waterfall-bridge-trees-woods-7962263/,jplenio,7645255,"waterfall, bridge, trees, woods, forest, spring, japan, long exposure, gohou waterfalls, yaotsu, water, travel, vacation, holiday, nature, travel, travel, travel, travel, travel",waterfall long exposure,
images/motion_003.jpg,5689446,https://pixabay.com/photos/gioc-village-waterfall-waterfalls-5689446/,Oliver_Nguyen,16040547,"gioc village waterfall, waterfalls, water, river, falls, streams, flow, flowing water, mountains, forest, trees, nature, outdoors, vietnam, long exposure, waterfalls, waterfalls, river, river, river, vietnam, vietnam, vietnam, vietnam, vietnam",waterfall long exposure,
images/life_001.jpg,7541743,https://pixabay.com/photos/leaves-fall-forest-beech-canopy-7541743/,DominikRh,12119308,"leaves, fall, forest, beech, canopy, tree, nature",forest canopy,
images/life_002.jpg,231066,https://pixabay.com/photos/forest-trees-tree-canopy-foliage-231066/,NASTER,105410,"forest, trees, tree canopy, foliage, greenery, plants, flora, nature, forest, forest, forest, forest, trees, trees, trees, trees, tree canopy, tree canopy, greenery, greenery, greenery, greenery, greenery",forest canopy,
images/life_003.jpg,3822149,https://pixabay.com/photos/trees-wilderness-nature-woods-3822149/,jplenio,7645255,"trees, wilderness, nature, woods, sunlight, landscape, branches, sunbeam, outdoors, forest, trees, trees, nature, nature, nature, nature, nature, forest, forest, forest, forest",forest canopy,
images/life_004.jpg,56930,https://pixabay.com/photos/forest-trees-sunlight-woods-56930/,ArtTower,5337,"forest, trees, sunlight, woods, branches, greenery, foliage, plants, flora, woodland, nature, countryside, forest, forest, forest, forest, forest, trees, nature, nature",forest canopy,
images/life_005.jpg,10164377,https://pixabay.com/photos/tree-moss-forest-nature-tanzania-10164377/,Dragon_XXC,51091612,"tree, moss, forest, nature, tanzania, kilimanjaro, africa, jungle, bark, mossy, green, dusty, old, rainforest, mountainous, ecosystem, region, landscape, botanical",forest canopy,
images/life_006.jpg,9715215,https://pixabay.com/photos/nature-landscape-japan-travel-9715215/,7010Naoto,51325792,"nature, landscape, japan, travel, kumamoto",forest canopy,
images/life_007.jpg,380037,https://pixabay.com/photos/lemon-butterflyfish-fishes-exotic-380037/,joakant,313743,"lemon butterflyfish, fishes, exotic, tropical, yellow, dive, underwater, water, sea, underwater world, sea creatures, maritime, nature, animals, reef, coral, coral reef, fishes, tropical, yellow, yellow, underwater, underwater, underwater, underwater, underwater, sea, sea, sea, sea, sea creatures, animals, reef, coral, coral, coral, coral reef, coral reef, coral reef, coral reef",coral reef fish,
images/energy_001.jpg,7401119,https://pixabay.com/photos/lightning-storm-sky-cloud-mountain-7401119/,gdmoonkiller,4679220,"lightning, nature, storm, sky, cloud, mountain, outdoor, wilderness, dark clouds",lightning storm,
images/energy_002.jpg,7558323,https://pixabay.com/photos/thunderstorm-lightning-night-greece-7558323/,fietzfotos,6795508,"thunderstorm, lightning, night, greece, nature, crete, sea, riverbank, coast, storm",lightning storm,
images/energy_003.jpg,749625,https://pixabay.com/photos/angel-sword-woman-wings-749625/,51581,51581,"angel, sword, woman, wings, angel wings, storm, stormy clouds, nature, clouds, grasslands, mysticism, god, revenge, evil, fantasy, photo manipulation, angel, angel, angel, angel, angel, woman, wings, god, god, fantasy",lightning storm,
images/energy_004.jpg,3749522,https://pixabay.com/photos/volcano-lava-rock-lava-flow-etna-3749522/,Pixaline,1569622,"volcano, lava rock, lava flow, etna, sicily, italy, mountain, lava, nature, crater, active, sulfur, karg, rock, volcanic rock, volcanism, catches, stiffens, volcano, volcano, volcano, volcano, etna, etna, sicily, lava, lava, lava, rock, rock, rock, rock, rock",lava flow volcano,
images/energy_005.jpg,271,https://pixabay.com/photos/volcano-lava-lava-flow-volcanism-271/,Simon,3,"volcano, lava, lava flow, iceland",lava flow volcano,
images/energy_006.jpg,422149,https://pixabay.com/photos/lava-flow-bush-volcano-422149/,marionberaudias,162133,"lava flow, bush, volcano, reunion island, indian ocean, inflamed, nature, endemic, lava flow, volcano",lava flow volcano,
